,date,tweet
2349,2016-06-03 12:43:51,"Rally last night in San Jose was great. Tremendous love and enthusiasm in the hall. Big crowd. Outside, small group of thugs burned Am flag!"
2350,2016-06-03 12:37:03,"Terrible jobs report just reported. Only 38,000 jobs added. Bombshell!"
2351,2016-06-03 05:24:28,"""@fivestarr6028: Yes! Hubby and I voted 4 @realDonaldTrump already! https://t.co/h1iHiJNUjm"" Thank you."
2352,2016-06-03 05:23:18,"""@LiliannyLeebou: I think the first female president of the USA will be @IvankaTrump a beautiful intelligent young genuine successful lady!"""
2353,2016-06-03 05:17:45,"""@LunsfordWhitney: This is rich coming from her. She tweeted you will be president! #Women4Ttump #Trump2016 https://t.co/2GSGfLS1yT"""
2354,2016-06-03 05:14:36,"""@angeloftruth11: Clinton says Trump is dangerous. Who's the one who killed 4 Americans in Benghazi?  https://t.co/ZV5ehm6NKR"""
2355,2016-06-03 05:11:27,"""@Crz4basball: @JudgeJeanine  @realDonaldTrump Looks like several legal Hispanics supporting Trump! They know he will be good for them too."""
2356,2016-06-03 03:42:51,"Then, on June 25th- back to the USA to MAKE AMERICA GREAT AGAIN!"
2357,2016-06-03 03:42:27,"After @TrumpScotland, I will visit @TrumpDoonbeg in Ireland, the magnificent resort fronting on the Atlantic Ocean."
2358,2016-06-03 03:41:05,"After @TrumpTurnberry I will be visiting Aberdeen, the oil capital of Europe, to see my great club, @TrumpScotland."
2359,2016-06-03 03:39:40,"On June 22- I will be going to Scotland to celebrate the opening of the newly renovated @TrumpTurnberry Resort, the worlds best."
2360,2016-06-03 03:38:56,"Join me in Redding, California- tomorrow at 1:00pm. #Trump2016
Tickets: https://t.co/tyllhxJHC7"
2361,2016-06-03 01:13:19,".@Natalie_Gulbis- Thank you for the nice piece in @SInow / @Golf_com.
Keep up the great work! https://t.co/JCZPCFx10X"
2362,2016-06-03 01:12:12,"RT @IvankaTrump: Beautiful article about @realDonaldTrump written by my friend, the incredibly talented golfer Natalie Gulbis:
https://t.co"
2363,2016-06-02 22:24:12,"""@RobertMordica: @realDonaldTrump Only Trump can save America. Right leader at the right time."" THANK YOU!"
2364,2016-06-02 22:22:20,"""@Valenti317: @realDonaldTrump she's a criminal and you're the only person that can stop her."""
2365,2016-06-02 22:20:29,"""@TaylorEdwards99: THIS IS @POTUS'S LEGACY! AN ABSOLUTE DISASTER!!! WE NEED @realDonaldTrump NOW!! #MAGA #TRUMP2016 https://t.co/lBgZJg0zd1"
2366,2016-06-02 22:18:50,"""@free_SA_BD: @realDonaldTrump A vote for Trump is a vote to restore our great country."""
2367,2016-06-02 22:16:50,"A 60% increase in Texas Blue Cross/Blue Shield through ObamaCare. I told you so, there is panic and anger as healthcare costs explode!"
2368,2016-06-02 21:12:54,So great to have the endorsement and support of Paul Ryan. We will both be working very hard to Make America Great Again!
2369,2016-06-02 19:18:14,Bad performance by Crooked Hillary Clinton! Reading poorly from the telepromter! She doesn't even look presidential!
2370,2016-06-02 19:15:33,Crooked Hillary no longer has credibility - too much failure in office. People will not allow another four years of incompetence!
2371,2016-06-02 17:06:29,"Crooked Hillary Clinton, who I would love to call Lyin' Hillary, is getting ready to totally misrepresent my foreign policy positions."
2372,2016-06-02 17:02:38,"After the litigation is disposed of and the case won, I have instructed my execs to open Trump U(?), so much interest in it! I will be pres."
2373,2016-06-02 16:54:21,"Even though I have a very biased and unfair judge in the Trump U civil case in San Diego, I have thousands of great reviews &amp; will win case!"
2374,2016-06-02 16:48:50,"With all of the Crooked Hillary Clinton's foreign policy experience, she has made so many mistakes - and I mean real monsters! No more HRC."
2375,2016-06-02 16:37:24,"Join me in San Jose, California- tonight!
#MakeAmericaGreatAgain #Trump2016
Tickets: https://t.co/jLQukR550J https://t.co/OrEhKJZ5Rd"
2376,2016-06-02 16:31:52,"Wow, USA Today did todays cover story on my record in lawsuits. Verdict: 450 wins, 38 losses. Isn't that what you want for your president?"
2377,2016-06-02 15:57:14,Do you ever notice that @CNN gives me very little proper representation on my policies. Just watched-nobody knew anything about my foreign P
2378,2016-06-02 15:10:22,Bernie Sanders was right when he said that Crooked Hillary Clinton was not qualified to be president because she suffers from BAD judgement!
2379,2016-06-02 15:03:21,Crooked Hillary Clinton has zero natural talent - she should not be president. Her temperament is bad and her decision making ability-zilch!
2380,2016-06-02 05:12:45,"""@HaloDad22: @realDonaldTrump I already voted for you! My wife did as well! I represent #Teachers4Trump! We represent #CA4Trump! #NeverDems"
2381,2016-06-02 05:11:16,"""@SCPioneer: @stockdaleism @JamesRosenFNC @FoxNews @realDonaldTrump Not for slackers! Happy w/courses I took."" Thanks."
2382,2016-06-02 04:58:34,"Thank you Sacramento, California! #MakeAmericaGreatAgain https://t.co/t75Zxn9L6f"
2383,2016-06-02 00:21:01,"Same failing @nytimes ""reporter"" who wrote discredited women's story last week wrote another terrible story on me today- will never learn!"
2384,2016-06-01 22:16:36,Crooked Hillary Clinton is a fraud who has put the public and country at risk by her illegal and very stupid use of e-mails. Many missing!
2385,2016-06-01 20:46:38,"Join me in San Jose, California- tomorrow evening at 7pm! 
#MakeAmericaGreatAgain #Trump2016
https://t.co/jLQukR550J https://t.co/Uds8OdH3A4"
2386,2016-06-01 13:17:58,"So I raised/gave $5,600,000 for the veterans and the media makes me look bad! They do anything to belittle - totally biased."
2387,2016-05-31 23:18:28,Congratulations to @seanhannity on his tremendous increase in television ratings. Speaking of ratings- I will be on his show tonight @ 10pE.
2388,2016-05-31 23:17:33,I am getting great credit for my press conference today. Crooked Hillary should be admonished for not having a press conference in 179 days.
2389,2016-05-31 23:14:42,"Katie Couric, the third rate reporter, who has been largely forgotten, should be ashamed of herself for the fraudulent editing of her doc."
2390,2016-05-31 22:51:56,I will be interviewed on @seanhannity tonight at 10pmE on @FoxNews. Enjoy!
2391,2016-05-31 21:12:07,"Join me in Sacramento, California-tomorrow evening @ 7pm! #Trump2016
https://t.co/W7xy7eXcii https://t.co/km0rRYSDnO"
2392,2016-05-31 16:57:17,So many veterans groups are beyond happy with all of the money I raised/gave! It was my great honor - they do an amazing job.
2393,2016-05-31 16:53:58,"Just finished a press conference in Trump Tower wherein I gave information on which VETERANS groups got the $5,600,000 that I raised/gave!"
2394,2016-05-31 11:42:20,"I have raised/given a tremendous amount of money to our great VETERANS, and have got nothing but bad publicity for doing so. Watch!"
2395,2016-05-31 10:48:49,"So many great things happening - new poll numbers looking good! News conference at 11:00 A.M. today, Trump Tower!"
2396,2016-05-30 21:55:41,"I should have easily won the Trump University case on summary judgement but have a judge, Gonzalo Curiel, who is totally biased against me."
2397,2016-05-30 21:45:09,"I have a judge in the Trump University civil case, Gonzalo Curiel (San Diego), who is very unfair. An Obama pick. Totally biased-hates Trump"
2398,2016-05-30 20:15:04,I hope everyone had a great Memorial Day!
2399,2016-05-30 20:15:04,I hope everyone had a great Memorial Day!
2400,2016-05-30 20:13:17,"I would have had millions of votes more in the primaries (than Crooked Hillary) if I only had one opponent, instead of sixteen. Broke record"
2401,2016-05-30 11:26:47,Have a great Memorial Day and remember that we will soon MAKE AMERICA GREAT AGAIN!
2402,2016-05-30 11:20:38,"""@NBCDFW: Trump rallies veterans at annual Rolling Thunder Gathering https://t.co/b08FcMlgkr https://t.co/RCDeLvHQqD"""
2403,2016-05-30 11:20:09,"""@FrankyLamouche: how many of donald's rolling thunder brigade will sign up and go to war for him in the middle east."""
2404,2016-05-30 11:19:29,"""@MariaErnandez3b: Trump Supports Rolling Thunder Rally #TRUMP STRONG https://t.co/pfVXQ8NdZu"" So true, and remember the M.I.A.'s!"
2405,2016-05-30 11:17:04,"""@ScottWRasmussen: Donald Trump and Bikers Share Affection at Rolling Thunder Rally https://t.co/ZZl2sc29dn"" A great day in D.C.!"
2406,2016-05-30 11:10:12,"""@TeaPartyNevada: #Trump2016 ""Illegals are taken care of better than our veterans.""  https://t.co/KKIgM4rNma https://t.co/1cEZ8wG7Cy"""
2407,2016-05-30 11:05:34,"The endorsement of me by the 16,500 Border Patrol Agents was the first time that they ever endorsed a presidential candidate. Nice!"
2408,2016-05-30 11:00:47,"In getting the endorsement of the 16,500 Border Patrol Agents (thank you), the statement was made that the WALL was very necessary!"
2409,2016-05-30 10:41:49,Obama says a WALL at our southern border won't enhance our security (wrong) and yet he now wants to build a much bigger wall (fence) at W.H.
2410,2016-05-29 23:02:01,"If dummy Bill Kristol actually does get a spoiler to run as an Independent, say good bye to the Supreme Court!"
2411,2016-05-29 22:58:27,The Republican Party has to be smart &amp; strong if it wants to win in November. Can't allow lightweights to set up a spoiler Indie candidate!
2412,2016-05-29 22:53:16,"Bill Kristol has been wrong for 2yrs-an embarrassed loser, but if the GOP can't control their own, then they are not a party. Be tough, R's!"
2413,2016-05-29 21:43:15,Good news is that my campaign has perhaps more cash than any campaign in the history of politics- b/c I stand 100% behind everything we do.
2414,2016-05-29 16:45:44,Heading to D.C. to see and hear ROLLING THUNDER. Amazing people that LOVE OUR COUNTRY. Great spirit!
2415,2016-05-29 11:04:47,Honor Memorial Day by thinking of and respecting all of the great men and women that gave their lives for us and our country! We love them.
2416,2016-05-28 21:34:55,Does President Obama ever discuss the sneak attack on Pearl Harbor while he's in Japan? Thousands of American lives lost. #MDW
2417,2016-05-28 21:33:58,Don't believe the biased and phony media quoting people who work for my campaign. The only quote that matters is a quote from me!
2418,2016-05-28 20:28:48,"I am always on the front page of the failing @nytimes, but when I won the GOP nomination, I'm in the back of the paper. Very dishonest!"
2419,2016-05-28 20:28:40,The media is on a new phony kick about my management style. I spend much less money &amp; get much better results! What we need as Prez!
2420,2016-05-28 20:28:22,"The failing @nytimes wrote a story about my management style &amp; that I don't have many people. I have 73, Hillary has 800- &amp; I'm beating her."
2421,2016-05-28 14:47:16,I (we) broke the all-time record for most votes gotten in a Republican Primary - by a lot - and with many states left to go! Thank you.
2422,2016-05-28 13:47:10,"The U.S. has 69 treaties with other countries where we would have to defend them and their borders. How nice, but what do we get? NOT ENOUGH"
2423,2016-05-28 06:19:54,"Great rally in Fresno, California- great crowd! Thank you! #Trump2016 https://t.co/TVSPvxOmve"
2424,2016-05-28 04:13:54,"Obama administration fails to screen Syrian refugees' social media accounts:
https://t.co/MMa07nwa44"
2425,2016-05-28 02:48:22,.@SanDiegoPD- Fantastic job on handling the thugs who tried to disrupt our very peaceful and well attended rally. Greatly appreciated!
2426,2016-05-28 02:19:19,Thank you @BillyJoel- many friends just told me you gave a very kind shoutout at MSG. Appreciate it- love your music!
2427,2016-05-27 23:20:01,"Wow- 25,000 in San Diego, California!
Thank you!! #Trump2016 https://t.co/1NRj3zCuui"
2428,2016-05-27 23:19:20,"I am on @oreillyfactor tonight, a big special. @FoxNews  at 8:00 P.M. ENJOY!"
2429,2016-05-27 17:35:56,"Bill O'Reilly doing a major special on @OreillyFactor tonight- @FoxNews at 8pmE. Watch it, should be good! #Trump2016"
2430,2016-05-27 14:10:07,"AN AMERICA FIRST ENERGY PLAN
#MakeAmericaGreatAgain #Trump2016
https://t.co/kTi6e1zyNI https://t.co/WjI8Rx11no"
2431,2016-05-27 02:09:03,Poll data shows that @marcorubio does by far the best in holding onto his Senate seat in Florida. Important to keep the MAJORITY. Run Marco!
2432,2016-05-26 22:57:39,"Today we, together, won the Republican Nomination for President! https://t.co/82l6TjA2lk"
2433,2016-05-26 22:22:50,"My wife @MELANIATRUMP, and my children will be featured on @FoxNews with @Greta- 7pmE. Enjoy!
#MeetTheTrumps #Trump2016"
2434,2016-05-26 21:30:31,"Celebrating 1237! #Trump2016 
https://t.co/hPQJc7eor0"
2435,2016-05-26 21:28:22,"Thank you! #Trump2016
https://t.co/SPJfMFyPjU"
2436,2016-05-26 21:15:16,"I find it offensive that Goofy Elizabeth Warren, sometimes referred to as Pocahontas, pretended to be Native American to get in Harvard."
2437,2016-05-26 18:59:12,Thank you Mr. &amp; Mrs. @TomBarrackJr for the wonderful and magical evening last night. It will not be forgotten. #Trump2016
2438,2016-05-26 16:35:00,.@kimguilfoyle- just watched you on @OutnumberedFNC- thank you!
2439,2016-05-26 13:18:27,The Inspector General's report on Crooked Hillary Clinton is a disaster. Such bad judgement and temperament cannot be allowed in the W.H.
2440,2016-05-25 23:18:54,"Thank you Anaheim, California!
#Trump2016 https://t.co/AEShamhNVS"
2441,2016-05-25 18:42:55,"Thank you Washington! Honored to say, on behalf of our great movement, we have broken the all time record for votes in GOP primary history."
2442,2016-05-25 13:39:38,"The protesters in New Mexico were thugs who were flying the Mexican flag. The rally inside was big and beautiful, but outside, criminals!"
2443,2016-05-25 13:14:58,Crooked Hillary Clinton just can't close the deal with Bernie. I had to knock out 16 very good and smart candidates. Hillary doesn't have it
2444,2016-05-25 12:31:56,"Goofy Senator Elizabeth Warren @elizabethforma has done less in the U.S. Senate than practically any other senator. All talk, no action!"
2445,2016-05-25 12:17:40,"@elizabethforma  Goofy Elizabeth Warren, sometimes known as Pocahontas, bought foreclosed housing and made a quick killing. Total hypocrite!"
2446,2016-05-25 05:47:45,"""@gordonsr1052:  Washington, BIG Thank You for supporting Trump! We are all going to help Trump Make America Great Again! Trump2016!"""
2447,2016-05-25 05:45:19,"""@buiIdthewall: @realDonaldTrump high energy!"""
2448,2016-05-25 05:45:11,"""@PiperSul: Great speech tonight Mr.Trump! Good Luck in California! Thank you."
2449,2016-05-25 05:42:59,"""@DeepakS76435750: @realDonaldTrump congratulations from India"""
2450,2016-05-25 05:42:49,"""@oasisupernova: @realDonaldTrump UP TO 8.4 MILLION FOLLOWERS. CAN'T STOP THE #TrumpTrain  #MakeAmericaGreatAgain"""
2451,2016-05-25 05:41:38,"""@jknatter: @realDonaldTrump #TrumpTrain"""
2452,2016-05-25 05:41:30,"""@tcloer11: @realDonaldTrump Great job! Make America Great Again!"""
2453,2016-05-25 05:37:29,"@elizabethforma Goofy Elizabeth Warren, sometimes referred to as Pocahontas because she faked the fact she is native American, is a lowlife!"
2454,2016-05-25 05:12:44,"Great rally in New Mexico, amazing crowd! Now in L.A. Big rally in Anaheim."
2455,2016-05-25 03:26:20,"Thank you Washington! #Trump2016
#MakeAmericaGreatAgain https://t.co/v9glTwj6gy"
2456,2016-05-25 00:33:27,Great honor to receive today's endorsement of @RickSantorum. Really nice! #Trump2016
2457,2016-05-25 00:32:47,"After raising, w/ no obligation, almost $6M for Vets, I couldn't believe protesters formed @ Trump Tower. JUST OUT- SENT BY CROOKED HILLARY!"
2458,2016-05-24 21:00:07,"Thank you @DailyMail- for setting the failing @NYTimes story straight. This is what the NYT's should have written! 
https://t.co/Feb6dhctQo"
2459,2016-05-24 15:09:24,A suggestion for the dishonest media- https://t.co/zKyRwEaLmz
2460,2016-05-24 15:03:39,A wonderfully written article concerning Israel by @JasonDovEsq https://t.co/LZ9qWRYzdj
2461,2016-05-24 14:35:32,A great new book has been written about Crooked Hillary. Read it &amp; you will never be able to vote for her. @Ed_Klein https://t.co/ujDwSSFhbx
2462,2016-05-24 11:42:35,"Crooked Hillary Clinton overregulates, overtaxes and doesn't care about jobs. Most importantly, she suffers from plain old bad judgement!"
2463,2016-05-24 10:41:44,"I just released my financial disclosure forms, the largest numbers in the history of the F.E.C. Even the dishonest media thinks great!"
2464,2016-05-24 02:50:48,"Amazingly, with all of the money I have raised for the vets, I have got nothing but bad publicity from the dishonest and disgusting media."
2465,2016-05-24 02:46:08,"Much of the money I have raised for our veterans has already been distributed, with the rest to go shortly to various other veteran groups."
2466,2016-05-24 02:38:48,"While under no obligation to do so, I have raised between 5 &amp; 6 million dollars, including 1million dollars from me, for our VETERANS. Nice!"
2467,2016-05-24 00:25:41,"Join me in California or Montana!
5/25/16: Anaheim, California
https://t.co/mmPck1HYrC
5/26/16: Billings, Montana
https://t.co/atvrCgjFDe"
2468,2016-05-23 23:42:39,I will be interviewed on @oreillyfactor at 8:00 P.M. Enjoy!
2469,2016-05-23 17:15:20,"Obamas VA Secretary just said we shouldn't measure
wait times. Hillary says VA problems are not widespread. I will take care of
our vets!"
2470,2016-05-23 15:32:11,Is Hillary really protecting women? https://t.co/8ZtEIWNqz4
2471,2016-05-23 13:46:57,"In trade, military and EVERYTHING else, it will be AMERICA FIRST! This will quickly lead to our ultimate goal: MAKE AMERICA GREAT AGAIN!"
2472,2016-05-22 22:54:48,Thank you America! #Trump2016 https://t.co/xfINxdRNiQ
2473,2016-05-22 20:44:48,The American people are sick and tired of not being able to lead normal lives and to constantly be on the lookout for terror and terrorists!
2474,2016-05-22 20:32:33,Bernie Sanders is continuing his quest because he believes that Crooked Hillary Clinton will be forced out of the race - e-mail scandal!
2475,2016-05-22 19:46:57,"Join me on Wednesday, May 25th at the Anaheim Convention Center!
#Trump2016 #MAGA 
Tickets: https://t.co/mmPck1HYrC https://t.co/xGkVbxTamz"
2476,2016-05-22 19:38:18,Crooked Hillary wants a radical 500% increase in Syrian refugees. We cant allow this. Time to get smart and protect America!
2477,2016-05-22 19:37:05,"How can Crooked Hillary say she cares about women when she is silent on radical Islam, which horribly oppresses women?"
2478,2016-05-22 15:28:44,RT @gatewaypundit: BREAKING POLL: Trump Gains 11 Points on Clinton Since March=&gt; Now Leads Crooked Hillary 46-44 https://t.co/y3BGy15Erb vi
2479,2016-05-22 14:47:45,Why do the networks continue to put dopey @BillKristol on panels when he has called every single shot about me wrong for 2 yrs?
2480,2016-05-22 12:47:48,Hillary Clinton is not qualified to be president because her judgement has been proven to be so bad! Would be four more years of stupidity!
2481,2016-05-22 03:55:39,Crooked Hillary said that I  want guns brought into the school classroom. Wrong!
2482,2016-05-22 03:44:05,"""@dubilujane: I trust @realDonaldTrump more anyone ever to protect America.He WILL do the right thing for the U.S.A, without a  doubt."
2483,2016-05-21 20:13:08,Thank you to all of the men and women who have served our country. You are our true heroes! #ArmedForcesDay https://t.co/A3Wus0cRIO
2484,2016-05-21 17:02:41,"Crooked Hillary Clintons foreign interventions unleashed ISIS in Syria, Iraq and Libya. She is reckless and dangerous!"
2485,2016-05-21 17:00:42,MAKE AMERICA GREAT AGAIN! https://t.co/MAZK5bdZuD
2486,2016-05-21 16:08:26,".@CNN is so negative, getting even worse as I get closer. Just had two anti-Trump losers with zero rebuttal from my team. Turning off!"
2487,2016-05-21 13:34:02,"""@RBacliff: Hillary wants to rip the guns out of America's hands. No guns = no protection. Get on #TrumpTrain &amp; join @NRA to stop her."""
2488,2016-05-21 12:49:59,Crooked Hillary wants to get rid of all guns and yet she is surrounded by bodyguards who are fully armed. No more guns to protect Hillary!
2489,2016-05-21 10:56:20,"While our wonderful president was out playing golf all day, the TSA is falling apart, just like our government! Airports a total disaster!"
2490,2016-05-21 01:56:44,Crooked Hillary is spending tremendous amounts of Wall Street money on false ads against me. She is a very dishonest person!
2491,2016-05-21 01:51:57,Crooked Hillary Clinton wants to essentially abolish the 2nd Amendment. No gun owner can ever vote for Clinton!
2492,2016-05-21 00:44:43,"Thank you @TheTodaysGolfer for the wonderful statement that ""the new par 3 9th hole @Trump Turnberry could be the most dramatic in Britain."""
2493,2016-05-20 23:36:17,"@montgomeriefdn  Colin, great to have you at Trump Turnberry. So proud of you and your GREAT playing! You made winning MAJORS look easy!"
2494,2016-05-20 23:27:38,"""@montgomeriefdn: @TrumpTurnberry Best Links Course in Britain. Ailsa Course opens June '16 Can't wait to play it https://t.co/HnQbj3ipuS"""
2495,2016-05-20 22:50:18,Thank you for your wonderful endorsement today @TGowdySC. It means a great deal to me. We will not disappoint! #Trump2016
2496,2016-05-20 21:55:40,"Great day in Kentucky with Wayne LaPierre, Chris Cox &amp; the @NRA! 
#MakeAmericaGreatAgain #Trump2016 https://t.co/aJ7s0aqqj0"
2497,2016-05-20 20:06:48,Thank you! An honor to be the first candidate ever endorsed by the @NRA- prior to @GOPconvention! #Trump2016 #2A  https://t.co/ygLUAl7gzx
2498,2016-05-20 16:11:21,Failing @NYTimes will always take a good story about me and make it bad. Every article is unfair and biased. Very sad!
2499,2016-05-20 16:09:16,"Thanks @piersmorgan! 
""Trump is the most unpredictable, extraordinary, entertaining&amp;massively popular candidate this country has ever seen."""
2500,2016-05-20 15:36:44,Crooked Hillary Clinton- discussing the #SecondAmendment at a private event. #2A cc: @NRA https://t.co/vV31Pbpkmn
2501,2016-05-20 15:15:08,I am on my way! See you all soon! https://t.co/Arw19Antpj
2502,2016-05-20 14:30:06,"""A Call for Unity"" by Jason Greenblatt @JasonDovEsq https://t.co/dQi3Cydckp"
2503,2016-05-20 10:26:20,Crooked Hillary can't even close the deal with Bernie - and the Dems have it rigged in favor of Hillary. Four more years of this? No way!
2504,2016-05-20 10:08:49,Crooked Hillary Clinton looks presidential? I don't think so! Four more years of Obama and our country will never come back. ISIS LAUGHS!
2505,2016-05-20 09:58:47,"Look where the world is today, a total mess, and ISIS is still running around wild. I can fix it fast, Hillary has no chance!"
2506,2016-05-20 09:47:09,"Crooked Hillary has zero imagination and even less stamina. ISIS, China, Russia and all would love for her to be president. 4 more years!"
2507,2016-05-20 09:40:37,"I said that Crooked Hillary Clinton is ""not qualified"" to be president because she has ""very bad judgement"" - Bernie said the same thing!"
2508,2016-05-19 19:36:58,"Thank you @LtStevenLRogers. We will respond to terrorism with strength in 2017!
https://t.co/Mk4YuuRf4s"
2509,2016-05-19 17:29:36,How quality a woman is Rowanne Brewer Lane to have exposed the @nytimes as a disgusting fraud?  Thank you Rowanne.
2510,2016-05-19 10:27:48,"Looks like yet another terrorist attack. Airplane departed from Paris. When will we get tough, smart and vigilant? Great hate and sickness!"
2511,2016-05-19 02:52:29,My list of potential U.S. Supreme Court Justices was very well recieved. During the next number of weeks I may be adding to the list!
2512,2016-05-19 01:54:08,"Some low-life journalist claims that I ""made a pass"" at her 29 years ago. Never happened! Like the @nytimes story which has become a joke!"
2513,2016-05-18 23:14:39,"#MakeAmericaGreatAgain #Trump2016
https://t.co/kXhc2j94YF https://t.co/YZAdAndKXv"
2514,2016-05-18 17:47:19,Thank you Louisiana! #Trump2016 https://t.co/u8hhrRRFMp
2515,2016-05-18 17:38:20,"Thank you Arizona! See you soon!
#MakeAmericaGreatAgain https://t.co/IC3pe5lRAS"
2516,2016-05-18 16:39:07,Why did Clinton supporter @AlisonForKY declare Crooked Hillary winner in KY when AP hasn't even called the race?
2517,2016-05-18 11:20:19,Bernie Sanders is being treated very badly by the Democrats - the system is rigged against him. Many of his disenfranchised fans are for me!
2518,2016-05-18 04:22:01,"Paul Begala, the dopey @CNN flunky and head of the Pro-Hillary Clinton Super PAC, has knowingly committed fraud in his first ad against me."
2519,2016-05-18 04:03:08,"""@ShoneeP: @realDonaldTrump Trump for President! Bernie is a joke, knows nothing - and Hillary is yesterday's and today's nightmare"""
2520,2016-05-18 03:46:26,"""@MagicMetalNinja:  The Trump movement will not be stopped. We support Trump because he is a true American looking out for #AmericaFIRST."""
2521,2016-05-18 03:24:48,"Congratulations to THE MOVEMENT, we have just won THE GREAT STATE OF OREGON. The vote percentage is even higher than anticipated! Thank you."
2522,2016-05-18 03:15:07,"Thank you Oregon! #Trump2016 
#MakeAmericaGreatAgain https://t.co/hK1yqlp9ca"
2523,2016-05-18 02:41:22,"""@LouDobbs: Hillary Just Handed @realDonaldTrump a Huge Gift: Promising to Put Bubba in Charge of the Economy! #MakeAmericaGreatAgain!"
2524,2016-05-18 02:40:34,"""@sandrajeanne48: No way I believe Trump at 70% disapproval with women. Went to 3 rallies. At least 1/2 women. MSM LIES @TheFive"""
2525,2016-05-18 02:38:07,"Michael Barbaro, the author of the now discredited @nytimes hit piece on me with women, has in past tweeted badly about me. He should resign"
2526,2016-05-18 02:14:51,"""@michael_favreau: @JIS3 @realDonaldTrump He will destroy Hillary but why give CNN record breaking ratings CNN can go to hell. Trump 2016"""
